{
  "$schema": "../schemas/post.schema.json",
  "slug": "best-vitamins-for-energy",
  "title": "Best Vitamins for Energy",
  "excerpt": "Top vitamin supplements to help your family stay energized and healthy. Affordable options that deliver real results.",
  "html": "<article><h1>Best Vitamins for Energy</h1><p>Sending vitamins to family is one of the most practical gifts you can give. Here are our top picks that combine quality ingredients with affordable prices.</p><section><h2>1. Nature Made Vitamin B12</h2><p>A trusted brand with excellent absorption. Perfect for boosting energy levels naturally.</p></section><section><h2>2. Garden of Life Vitamin Code</h2><p>Whole food vitamins that are gentle on the stomach and highly effective.</p></section><section><h2>3. NOW Foods B-Complex</h2><p>Great value for a complete B-complex formula.</p></section></article>",
  "categorySlug": "health-personal-care",
  "products": [
    {
      "asin": "B004LKVRLG",
      "title": "Nature Made Vitamin B12 1000 mcg",
      "price": "$12.49",
      "rating": 4.8,
      "reviewCount": 52340,
      "imageUrl": "https://m.media-amazon.com/images/I/71xq1IK2S9L._AC_SL1500_.jpg",
      "affiliateUrl": "https://www.amazon.com/dp/B004LKVRLG?tag=veguitas-20",
      "rank": 1,
      "badge": "Amazon's Choice",
      "pros": ["Trusted brand", "High absorption", "Great value"],
      "cons": ["Large pills"]
    },
    {
      "asin": "B003TPGP2G",
      "title": "Garden of Life Vitamin Code Raw B-Complex",
      "price": "$24.99",
      "rating": 4.6,
      "reviewCount": 18920,
      "imageUrl": "https://m.media-amazon.com/images/I/71H0QYL0GPL._AC_SL1500_.jpg",
      "affiliateUrl": "https://www.amazon.com/dp/B003TPGP2G?tag=veguitas-20",
      "rank": 2,
      "pros": ["Whole food sourced", "Includes probiotics", "Vegetarian"],
      "cons": ["Higher price point"]
    },
    {
      "asin": "B00018DCS8",
      "title": "NOW Foods B-100 Complex",
      "price": "$15.99",
      "rating": 4.7,
      "reviewCount": 31200,
      "imageUrl": "https://m.media-amazon.com/images/I/71KfODXl1yL._AC_SL1500_.jpg",
      "affiliateUrl": "https://www.amazon.com/dp/B00018DCS8?tag=veguitas-20",
      "rank": 3,
      "pros": ["Complete B-complex", "Affordable", "Vegetarian capsules"],
      "cons": ["May cause neon urine"]
    }
  ],
  "metaTitle": "Best Vitamins for Energy 2024 | Top Picks",
  "metaDescription": "Discover the best vitamins for energy. We review top B12 and B-complex supplements that deliver real results at affordable prices.",
  "publishedAt": "2024-01-05T00:00:00.000Z",
  "updatedAt": "2024-01-05T00:00:00.000Z"
}
